ID,question,tags
428,What horror story do you have from a job you’ve had?,
429,How self-motivated are you?,
430,"If your life was a reality show, what would the premise be?",
431,What would be the title of the movie of your life?,
432,What is the most expensive thing you’ve ever lost?,
433,When was the last time you got to tell someone “I told you so.”?,
434,What inconsequential super power would you like to have?,
435,When was the last time you cried?,
436,Are you an impulsive type of person?,
437,What memory of yours feels real but is most likely false?,
438,What’s the craziest video you’ve ever seen?,
439,Do you still remember the place where we first met?,
440,"Out of the four seasons, what’s your favorite one?",
441,Which fictional book character would like to meet in the future?,
442,Do you judge a book on its cover?,
443,Do you believe in second chances?,
444,What is the most overrated movie?,
445,What are the songs that make you sing along whenever you hear it?,
446,What is the spiciest thing you’ve ever eaten?,
447,What happens in your country regularly that people in most countries would find strange or bizarre?,
448,What’s the clumsiest thing you’ve done?,
449,Do you like to save more or spend more?,
450,What kind of people do you surround yourself with?,
451,Have you ever thrown someone an extravagant party?,
452,What’s your least favorite condiment?,
453,Which one do you prefer: summer or winter?,
454,What is one thing you wish you knew in high-school?,
455,What’s your most embarrassing moment in grade school?,
456,What’s the funniest joke you know by heart?,
457,What’s the most beautiful part of your face?,
458,What makes you the proudest?,
459,Which toy do you wish didn't exist?,
460,What actors or actresses can’t play a different character because they played their most famous character too well?,
461,"What’s something that everyone, absolutely everyone, in the entire world can agree on?",
462,What is your most cherished possession?,
463,What feels like a lifetime ago but was relatively recent?,
464,Would you rather visit your ancestors in the past or meet your descendants in the future?,
465,What job do you think won’t exist anymore in the future?,
466,Can you show me your oldest item inside your closet?,
467,Would you break the law to save a loved one?,
468,What outdated slang do you use on a regular basis?,
469,What’s the most depressing meal you’ve eaten?,
470,"Who did you use to look up to, but they screwed up and you lost faith in them?",
471,How much of a role do you think A.I. will play in the near future?,
472,What’s the craziest conversation you’ve overheard?,
473,How did your parents meet?,
474,How do you think the internet would change if all advertising was banned on the internet?,
475,What’s the silliest thing you’ve seen someone get upset about?,
476,How do you inspire other people?,
477,"If you couldn’t be convicted of any one type of crime, what criminal charge would you like to be immune to?",
478,What’s the weirdest thing about modern life that people just accept as normal?,
479,What is the luckiest thing to ever happen to you?,
480,When was the last time you were hopelessly lost?,
481,What traits did you get from your parents?,
482,What’s the weirdest thing that has happened to you while working at your job?,
483,What is your biggest accomplishment in life?,
484,What are you not phased by?,
485,"If you could have any animal as a pet, what would you choose?",
486,What special skill would you want to have?,
487,What advice would you give your 5-year-old self?,
488,Where would you go if you could teleport yourself from one place to another?,
489,Do you get bored easily?,
490,What’s the most epic way you’ve seen someone quit or be fired?,
491,Do you believe in karma?,
492,What would our friendship be called if it was a comedy movie?,
493,What’s the most addictive game for you?,
494,What did you think was going to be amazing but turned out to be horrible?,
495,What are the musical instruments you can play?,
496,What’s the funniest actual name you’ve heard of someone having?,
497,Whats your biggest fear?,
498,What would the adult version of an ice-cream truck sell and what song would it play?,
499,What’s the scariest thing you’ve ever seen?,
500,"What songs do you feel compelled to sing along with when you hear them, even if you don’t totally know all the words?",
501,What are your top 5 favorite fast-food restaurants?,
502,Do you have any useless talents?,
503,What is the best complement you’ve ever received?,
504,"If you could dedicate your life to solving one problem, which would you choose?",
505,What are some of the most common misconceptions?,
506,What is the most irritating sound?,
507,What’s the last movie you watched?,
508,What is something you always travel with?,
509,What do you know the most about?,
510,Who is your greatest enemy?,
511,Are you a morning person or a night person?,
512,Have you ever had a paranormal experience?,
513,What weird food do you love?,
514,What is your favorite accessory?,
515,"What’s legal now, but probably won’t be in 25 years?",
516,What was one experience that you were hesitant to try but are really glad you did?,
517,What product or service is way more expensive than it needs to be?,
518,What was the best part about college?,
519,What bizarre food pairing do you love?,
520,What are a couple of your favorite quotes?,
521,What do you do to make the world a better place?,
522,"Would you rather fight a horse-sized duck, or a 100 duck-sized horses?",
523,Do you believe in aliens?,
524,How much do you recycle?,
525,What is the best part of this period your life? What do you think you’ll be nostalgic for?,
526,What is your favorite sports team?,
527,Where do you see yourself in the next 5 years?,
528,What’s the best gift you’ve ever given someone?,
529,What movie makes you laugh even after watching it several times?,
530,How much time do you spend on your phone?,
531,Can you do your best impression of someone famous?,
532,What’s the last food you ate?,
533,"What does the opposite sex do that you wish that you could do, but it’s not anatomically feasible or it’s socially frowned upon?",
534,What are the things I do that you wish I would stop doing?,
535,Do you think you are good leader or would make a good leader? Why or why not?,
536,What’s the food you usually refuse to share?,
537,What is your favorite indoor activity?,
538,"If you were a pair of shoes, what brand would you like to be?",
539,What do people usually come to you for advice on?,
540,Who is your childhood best friend?,
541,What expression do you use the most?,
542,What is the perfect room temperature?,
543,When was the last time you went camping?,
544,"If you had to disappear and start a whole new life, what would you want your new life to look like?",
545,What did you learn today?,
546,What are some of the most interesting facts about the natural world you know?,
547,What has been the longest time you had to wait for someone?,
548,What’s a movie that made you cry from laughter?,
549,What was the most important appointment or deadline you missed?,
550,What is your all-time favorite movie?,
551,What is the absolute worst last name someone can have?,
552,What are you a stickler for?,
553,What was one of the most interesting concerts you’ve been to?,
554,What was your favorite book as a kid?,
555,How much do you plan / prepare for the future?,
556,"If you could be any type of object, what would you like to be?",
557,"If you were given a PhD degree, but had no more knowledge of the subject of the degree besides what you have now, what degree would you want to be given to you?",
558,"For a day, would you rather be a hobbit or an elf?",
559,What is one bad habit we are all better off without?,
560,Can you carry an elephant?,
561,What’s the scariest non-horror movie?,
562,What’s the most anxiety inducing thing you do on a regular basis?,
563,What story you’ve heard has stayed with you and always disturbs you every time you think about it?,
564,What’s your worst personality trait?,
565,What’s the opposite of a koala?,
566,In what area of life do you not trust your judgment?,
567,What’s the most trouble you’ve ever been in?,
568,What obstacles would be included in the World’s most amazing obstacle course?,
569,What syrup do you like with your pancake: honey or chocolate?,
570,What makes your day better?,
571,What do you usually do during weekends?,
572,"What’s the most boring sport, and what would you do to make it more exciting?",
573,What unethical experiment would have the biggest positive impact on society as a whole?,
574,What's the fanciest event you've ever attended?,
575,What’s the most awkward thing that happens to you on a regular basis?,
576,What is your current favorite TV show?,
577,Are you an indoor or outdoor person?,
578,"If dark chocolate is the only available food in this planet, would you eat it?",
579,"Tear gas makes people cry and laughing gas makes people giggle, what other kinds of gases do you wish existed?",
580,Do you like to stalk someone on social media?,
581,What is your worst daily habit?,
582,What’s your secret talent?,
583,Do you think life after death is really possible?,
584,What’s incredibly cheap and you would pay way more for?,
585,What do you spend the most time worrying about?,
586,Which celebrity would you want to be friends with in real life?,
587,What is a memorable mess you had to clean up?,
588,What common expression is total B.S.?,
589,Who do you feel like you know even though you’ve never met them?,
590,What was your happiest age?,
591,How many times has your heart been broken?,
592,What is the creepiest thing anyone has ever said to you?,
593,What are you currently worried about?,
594,Who has zero filter between their brain and mouth?,
595,When was the time you felt really proud of me?,
596,What food do you crave most often?,
597,What one person did you have on your wall in high-school?,
598,What are the facts about you that you think I would find difficult to believe?,
599,Who do you wish you could get back into contact with?,
600,What’s a movie that made you cry from sadness?,
601,What do a lot of people hope will happen but is just not going to happen?,
602,What app do you check the most?,
603,Which one do you like: foot massage or hand massage?,
604,What is the most scared you’ve ever been?,
605,Who do you go out of your way to be nice to?,
606,What’s your favorite TV show of all time?,
607,What’s something that you don’t know that you want to learn?,
608,"If you could make one word famous, what would it be?",
609,What is your dream for me?,
610,Which one do you prefer: being controlled or be in control?,
611,"If you could be part of another family, whose family would it be?",
612,What is your dream laptop?,
613,What was your favorite childhood snack?,
614,What’s something people don’t worry about but really should?,
615,Which celebrity has let fame get to their head the most?,
616,What’s your funniest story involving a car?,
617,What’s your best story from a wedding?,
618,"What’s something that people think makes them look cool, but actually has the opposite effect?",
619,Could you describe your favorite material object that you already have?,
620,What qualities do all your friends have in common?,
621,Who was your craziest / most interesting teacher?,
622,Where do you like to go right now?,
623,Who you share the last slice of cake with if there was just one piece left at your birthday party?,
624,What was your biggest childhood fear?,
625,Who’s the messiest person you’ve ever known?,
626,What’s the coldest you’ve ever been?,
627,What are some misconceptions about your hobby?,
628,Would you rather go back in time or forward in time?,
629,What’s the weirdest Halloween costume you have ever worn in your entire life?,
630,What topic could you spend hours talking about?,
631,What is the coolest animal in the wild?,
632,What big event do you think will happen soon that most people aren’t expecting?,
633,"In the past people were buried with the items they would need in the afterlife, what would you want buried with you so you could use it in the afterlife?",
634,How well do you handle spicy food?,
635,"When was the last time you were snooping, and found something you wish you hadn’t?",
636,What do you like most about going to the beach?,
637,Which celebrity is the most likely to have a collection of canes that are just for show?,
638,What songs do you only know the chorus to?,
639,Do you have a green thumb or hands of death when it comes to plants? What roughly is your kill / grow ratio?,
640,Do you think millennials are as bad as everyone says?,
641,What routine are you sick of but haven’t gotten around to changing it?,
642,What TV show character would it be the most fun to change places with for a week?,
643,When was the last time you stayed up through the entire night?,
644,Who should everyone follow on social media?,
645,"Most cultures have some form of dance, what benefit do you think dancing gave to early humans?",
646,What were some of your favorite toys as a child?,
647,Which animal would you want to have a conversation with?,
648,"What age would you prefer if you could choose any age for the rest of your life, and why?",
649,"What sport could you play the longest in a televised game, without anyone discovering you aren’t a professional athlete?",
650,What’s your greatest philosophy in life?,
651,What book do you wish you had read even though you don’t want to read it?,
652,What’s missing in your life right now?,
653,Would you rather have a massage or get a facial?,
654,Do you think that children born today will have better or worse lives than their parents?,
655,Who is the most creative person you know?,
656,What have you wasted way too much time on?,
657,What word can you never spell right?,
658,What was something you really wanted to do as a kid but never had the opportunity to do?,
659,Did you ever think you had superpowers as a child?,
660,How would you pass the time if you were sentenced to jail for a year?,
661,Who is the most impressive famous person today?,
662,"If you could sit on a bench in the middle of a beautiful forest, who would you like to sit next to you and why?",
663,What emoji do you use the most?,
664,What’s about to get much better?,
665,What was the most terrifying experience of your life?,
666,What nicknames do you have for people in your life?,
667,What always makes you feel like a kid again?,
668,"If people receive a purple heart for bravery, what would other color hearts represent?",
669,What subject do you wish you knew more about?,
670,What job would you be terrible at?,
671,What’s your favorite action movie?,
672,How many countries have you visited so far?,
673,What’s a food trend you hate?,
674,What would you teach every girl on the planet about men if you had the chance?,
675,What’s your favorite sport?,
676,What would you do if ever we were given a special time together?,
677,What are you interested in that most people aren’t?,
678,What do you think about when you hear the word “classy”?,
679,Who was your favorite classmate?,
680,"If you could have one magic power, what would it be?",
681,What’s the most beautiful country you’ve ever visited?,
682,What would you like to be remembered for?,
683,What could you always use more of?,
684,What are the three most important life lessons you’ve learned?,
685,What are some pieces of art that had a big impact on you?,
686,What’s the spiciest thing you’ve ever eaten?,
687,What’s the best advice you could give your future children?,
688,What’s the hardest you’ve ever worked?,
689,"Do you prefer to be too hot or too cold, and why?",
690,What did you eat so much of that now you hate it?,
691,Do you think some adversity is good for a person? How much is too much?,
692,Do you think that wanting things necessarily leads to more sadness and misery?,
693,What’s your cure for hiccups?,
694,What do you do to relax and let off steam?,
695,Can you describe to me your relationship with your dad?,
696,"What character in a movie could have been great, but the actor they cast didn’t fit the role?",
697,Which celebrity would make you the most starstruck?,
698,What are your pet peeves?,
699,What was the best thing that happened to you today?,
700,How could you politely end a conversation with a person who is so annoying?,
701,What’s your good luck charm?,
702,Who in your life is the worst at using technology?,
703,What always makes you smile?,
704,What is something you’re happy you’ll never have to do again?,
705,What are some red flags to watch out for in daily life?,
706,What would your last meal be?,
707,What’s your favorite month?,
708,"If you could have coffee with anyone living or dead, who would it be?",
709,What usually scares you the most?,
710,Do you know any funny pick-up lines?,
711,What is your go-to dish in the kitchen?,
712,What’s your favorite place to hang out?,
713,Has anyone given you a strange gift?,
714,What is your favorite accent?,
715,What makes you feel most alive?,
716,What are your most important rules when going on a date?,
717,What small change greatly improves a person’s appearance?,
718,What’s been the biggest blessing in disguise in your life?,
719,What qualities do you want in a partner who will be with you for the rest of your life?,
720,What is something that will never go out of style?,
721,Would you spend a thousand dollars on food?,
722,What innovative idea or product have you heard about recently?,
723,What mythical creature do you wish actually existed?,
724,If you could teach any subject in school what would it be?,
725,What’s the worst movie trope?,
726,What food should taste better than its appearance?,
727,What should be a required subject in school?,
728,What will you tell your past self?,
729,What’s the smartest thing you’ve seen an animal do?,
730,What was the worst shopping experience you’ve ever had?,
731,"If you could classify people as being 2 types, what would they be?",
732,What was the most amazing physical feat you’ve managed to pull off?,
733,What is the craziest thing you’ve done this week?,
734,Which actor or actress is a one trick pony?,
735,How competitive are you?,
736,Can you guess what I’m thinking right now?,
737,Did you play sports growing up?,
738,What is the saddest thing you’ve ever seen?,
739,Which language do you wish you were fluent in?,
740,Where are you not welcome anymore?,
741,What is your most prized possession?,
742,What is your most impressive dance move?,
743,Which of your vices or bad habits would be the hardest to give up?,
744,What movie are you going to make if you become a filmmaker?,
745,What’s the most creative use of emojis you’ve ever seen?,
746,What did you buy recently?,
747,What product do you wish a company would make a “smart” version of?,
748,Are you afraid of ghosts?,
749,"What sports if any do you like to watch? If you aren’t into traditional sports, weird and uncommon sports count too.",
750,"If there was a book of commandments for the modern world, what would some of the rules be?",
751,When was the last time you immediately regretted something you said?,
752,How do you think countries could allocate their resources better?,
753,What is the worst backhanded compliment you’ve ever received?,
754,What’s the funniest word in the English language?,
755,Do you think celebrities can ever live normal lives?,
756,Have you ever counted your steps while walking?,
757,How big of a part of success does luck play?,
758,What game are you basically unbeatable at?,
759,What was the name of your first pet?,
760,"When no one is around, what do you like to wear?",
761,What’s your “and then it got worse” story?,
762,Did you ever think that clowns were creepy?,
763,What do you think about reality TV shows?,
764,Do you plan to have kids?,
765,"If you had a giraffe that you needed to hide, where would you hide it?",
766,What was the best year of your life?,
767,"When you reach the age of 80, what will matter the most to you?",
768,What are your phobias?,
769,What would be the worst food to be liquefied and drunk through a straw?,
770,What appliance would you have the hardest time doing without?,
771,Have you ever been fired?,
772,What’s the most disgusting sounding word in the English language?,
773,How would you describe me based on my outside appearance?,
774,How do you deal with feeling overwhelmed?,
775,What is your favorite movie to quote?,
776,How much sleep do you usually get?,
777,What would you be if you had to wear one Halloween costume every day for the rest of your life?,
778,"Without calling 911 when you are in danger, what would you do instead?",
779,What is something you saw that you wish you could un-see?,
780,What do you think God looks like?,
781,When was a time you acted nonchalant but were going crazy inside?,
782,What is the last show you binge-watched?,
783,What sport will be invented next?,
784,What questions would you like to ask a time traveler from 200 years in the future?,
785,How many of your Facebook friends are your actual friends?,
786,What famous person are you a little too obsessed with?,
787,Who would you want to portray your life story in a movie?,
788,What’s the best advice you’ve ever received?,
789,What is your favorite day of the week?,
790,What’s the most reckless thing you’ve ever done?,
791,"When the doctor says, ""You have 24 hours to live,"" what will you do with the time you have left?",
792,What bad habit is the hardest for you to kick?,
793,What is the most ridiculous fact you know?,
794,What’s the most physically painful thing you’ve ever experienced?,
795,Should kidneys be able to be bought and sold?,
796,What’s the most expensive thing you’ve ever purchased?,
797,What’s the worst thing about the internet?,
798,Would you rather take a walk through a forest or along a beach?,
799,When was the last time you’ve felt your biggest adrenaline rush?,
800,Do you think that humans will ever be able to live together in harmony?,
801,What two films would you like to combine into one?,
802,"If you were stuck on a deserted island, what is the one thing you couldn’t live without?",
803,What weird food combinations do you really enjoy?,
804,What was the biggest realization you had about yourself?,
805,Have you ever stolen food from the refrigerator and blamed it on someone?,
806,What current trend do you hope will go on for a long time?,
807,What’s your go-to cocktail?,
808,What trend do you think is on the way out?,
809,What bit of trivia do you know that is very interesting but also very useless?,
810,What’s the most boring super hero you can come up with?,
811,What’s your favorite social media account to follow?,
812,What is the most exciting thing going on in your life right now?,
813,What’s the best / worst practical joke that you’ve played on someone or that was played on you?,
814,How old were you when you were allowed to have a cellphone?,
815,"If you survived a plane crash, what would you do next?",
816,"If you were moving to another country, but could only pack one carry-on sized bag, what would you pack?",
817,What do you always procrastinate on?,
818,"Are you more of a ""fix it yourself"" or ""call an expert"" kind of person?",
819,"What do you think of the expression, “Love means never having to say you’re sorry”?",
820,What’s the best type of cheese for you?,
821,What are the things you’d bring in a zombie apocalypse?,
822,When was the most inappropriate time you busted out in laughter?,
823,Fun Questions to Ask Friends,
824,What was the worst day of your life?,
825,What is the nicest thing anyone has ever said to you?,
826,What karaoke song do people always butcher?,
827,What is the most common lie people tell themselves?,
828,What scientific discovery would change the course of humanity overnight if it was discovered?,
829,"What kind of company would you start if I offered you $50,000 to start one?",
830,Have you ever burned any bridges?,
831,What’s the most valuable thing you’ve learned in life?,
832,What's the craziest bet you have ever made?,
833,What’s the most recent show you’ve binge watched?,
834,What’s your Pandora station?,
835,What TV series could you watch several times?,
836,What age would you like to live to?,
837,Who is your favorite superhero?,
838,What do you think you do better than 90% of people?,
839,Which do you listen to the most: your heart or your brain?,
840,What’s the weirdest text or email you’ve gotten?,
841,What is your favorite sleeping position of all time?,
842,What is the weirdest superstition you’ve ever heard?,
843,Where do you draw your inner strength?,
844,What profession doesn’t get enough credit or respect?,
845,What movie should everyone see at least once?,
846,Which reality show would you want to be a guest star on?,
847,What’s your lucky number?,
848,"If you could switch two movie characters, what switch would lead to the most inappropriate movies?",
849,What was ruined because it became popular?,
850,What weird potato chip flavor that doesn’t exist would you like to try?,
851,What’s the most pleasant sounding accent?,
852,Do you believe aliens exist?,
853,"What invention doesn’t get a lot of love, but has greatly improved the world?",
